{
  "projectName": "Spec Kitty",
  "shortName": "Spec Kitty",
  "welcomeMessage": "Welcome to Spec Kitty!",
  "logoPath": "/static/spec-kitty.png",
  "faviconPath": "/static/spec-kitty.png",
  "colors": {
    "primary": "#A7C7E7",
    "secondary": "#7BB661",
    "accent": "#FFF275",
    "background": "#FFFDF7"
  },
  "footer": {
    "text": "Powered by Spec Kitty",
    "link": ""
  }
}
